{"app":{"platform":"ios","version":"sample"},"counts":{"assets":2,"businesses":1,"catalogItems":2,"clients":4,"documents":7,"numberingSeries":2,"payments":3},"createdAt":1029,"data":{"assets":[{"businessId":"b0000000-0000-4000-8000-000000000001","createdAt":1002,"dataBase64":"iVBORw0KGgoAAAANSUhEUgAAAAQAAAAECAYAAACp8Z5+AAAAEklEQVR42mM45KH1HxkzkC4AAKgYIzHyuLugAAAAAElFTkSuQmCC","id":"00000000-0000-4000-8000-000000000004","kind":"logo","mime":"image/png","sha256":"f4dbc9052de97f63481b30c869fd909a386f0ab69d1ea91b823896f768436b83","updatedAt":1002},{"businessId":"b0000000-0000-4000-8000-000000000001","createdAt":1002,"dataBase64":"iVBORw0KGgoAAAANSUhEUgAAAAQAAAACCAYAAAB/qH1jAAAAEUlEQVR42mOQElX4j4wZ0AUApqoKcQiRqlwAAAAASUVORK5CYII=","id":"00000000-0000-4000-8000-000000000005","kind":"signature","mime":"image/png","sha256":"78b7697cd6a41d57dca34b2ec57ce57c62cb761435c74501e0d389a2a00893a8","updatedAt":1002}],"businesses":[{"accentColor":"#0F766E","address":{"city":"Bengaluru","countryCode":"IN","line1":"12 MG Road","postalCode":"560001","regionCode":"29"},"bank":{"accountName":"Bharat Web Studio LLP","accountNumber":"000123456789","ifsc":"EXMP0001234"},"countryCode":"IN","createdAt":1002,"customRates":[{"category":"zero","components":[{"code":"TAX","label":"Tax","percent":"0"}],"effectiveFrom":"2000-01-01","id":"none","label":"No tax"}],"defaultNotes":"Thank you","defaultTerms":"Net 30","email":"hello@example.in","extraIds":{"lutReference":"AD2903260123456","lutValidUntil":"2027-03-31","pan":"AAGCB7383J"},"homeCurrency":"INR","id":"b0000000-0000-4000-8000-000000000001","legalName":"Bharat Web Studio LLP","logoAssetId":"00000000-0000-4000-8000-000000000004","name":"Bharat Web Studio","paymentTermsDays":30,"phone":"+91 80 5555 0100","reminderDaysAfterDue":3,"signatureAssetId":"00000000-0000-4000-8000-000000000005","taxConfig":"IN","taxId":"29AAGCB7383J1Z4","taxRegistration":"regular","templateId":"classic","turnoverMinor":5000000001,"updatedAt":1002,"upiVpa":"bharatweb@examplebank","website":"https://example.in"}],"catalogItems":[{"businessId":"b0000000-0000-4000-8000-000000000001","createdAt":1008,"currency":"INR","description":"Design and build, up to five pages","id":"ca000000-0000-4000-8000-000000000001","kind":"service","name":"Website design","priceIncludesTax":false,"productCode":"998314","rateId":"gst_18","unit":"JOB","unitPriceMinor":5000000,"updatedAt":1008},{"archivedAt":1500,"businessId":"b0000000-0000-4000-8000-000000000001","createdAt":1009,"currency":"INR","id":"ca000000-0000-4000-8000-000000000002","kind":"goods","name":"Printed brochures","priceIncludesTax":true,"productCode":"4911","rateId":"gst_5","unit":"NOS","unitPriceMinor":2500,"updatedAt":1009}],"clients":[{"billingAddress":{"city":"Bengaluru","countryCode":"IN","line1":"5 Residency Road","postalCode":"560025","regionCode":"29"},"businessId":"b0000000-0000-4000-8000-000000000001","contactName":"Anil Rao","countryCode":"IN","createdAt":1003,"email":"accounts@raotraders.example","id":"c0000000-0000-4000-8000-000000000001","isBusiness":true,"name":"Rao Traders","notes":"Pays by UPI","phone":"+91 80 5555 0199","regionCode":"29","shippingAddress":{"city":"Bengaluru","countryCode":"IN","line1":"Plot 7","line2":"Peenya Industrial Area","postalCode":"560058","regionCode":"29"},"taxId":"29AABCR1234C1ZU","updatedAt":1003},{"billingAddress":{"city":"Mumbai","countryCode":"IN","line1":"21 Nariman Point","postalCode":"400021","regionCode":"27"},"businessId":"b0000000-0000-4000-8000-000000000001","countryCode":"IN","createdAt":1004,"id":"c0000000-0000-4000-8000-000000000002","isBusiness":true,"name":"Mehta Exports","regionCode":"27","taxId":"27AAECM5678F1Z6","updatedAt":1004},{"archivedAt":1500,"businessId":"b0000000-0000-4000-8000-000000000001","countryCode":"IN","createdAt":1005,"id":"c0000000-0000-4000-8000-000000000003","isBusiness":false,"name":"Old Client","regionCode":"29","updatedAt":1005},{"businessId":"b0000000-0000-4000-8000-000000000001","countryCode":"IN","createdAt":1006,"deletedAt":1007,"id":"c0000000-0000-4000-8000-000000000004","isBusiness":false,"name":"Gone Ltd","regionCode":"29","updatedAt":1007}],"documents":[{"businessId":"b0000000-0000-4000-8000-000000000001","buyerSnapshot":{"address":"5 Residency Road, Bengaluru 560025","billingAddress":{"city":"Bengaluru","countryCode":"IN","line1":"5 Residency Road","postalCode":"560025","regionCode":"29"},"contactName":"Anil Rao","country":"IN","email":"accounts@raotraders.example","isBusiness":true,"name":"Rao Traders","phone":"+91 80 5555 0199","region":"29","shippingAddress":{"city":"Bengaluru","countryCode":"IN","line1":"Plot 7","line2":"Peenya Industrial Area","postalCode":"560058","regionCode":"29"},"taxId":"29AABCR1234C1ZU"},"clientId":"c0000000-0000-4000-8000-000000000001","computed":{"chargesTax":true,"inclusive":false,"issues":[],"lines":[{"amount":4500000,"category":"standard","discount":37879,"rate":"18","rateId":"gst_18","taxable":4462121,"taxes":[{"amount":401591,"component":"CGST","rate":"9"},{"amount":401591,"component":"SGST","rate":"9"}]},{"amount":1440000,"category":"standard","discount":12121,"rate":"18","rateId":"gst_18","taxable":1427879,"taxes":[{"amount":128509,"component":"CGST","rate":"9"},{"amount":128509,"component":"SGST","rate":"9"}]}],"notes":[],"placeOfSupply":"29","reverseCharge":false,"sameRegion":true,"taxLines":[{"category":"standard","charged":true,"component":"CGST","rate":"9","tax":530100,"taxable":5890000},{"category":"standard","charged":true,"component":"SGST","rate":"9","tax":530100,"taxable":5890000}],"title":"Tax Invoice","totals":{"discount":50000,"roundOff":0,"shipping":0,"subtotal":5940000,"tax":1060200,"taxNotCharged":0,"taxable":5890000,"total":6950200}},"createdAt":1010,"currency":"INR","discount":{"type":"amount","value":50000},"docType":"invoice","dueDate":"2026-10-19","id":"d0000000-0000-4000-8000-000000000001","issueDate":"2026-09-19","lifecycle":"issued","lines":[{"amountMinor":4500000,"catalogItemId":"ca000000-0000-4000-8000-000000000001","description":"Website design","discount":{"type":"percent","value":"10"},"id":"da000000-0000-4000-8000-000000000001","position":0,"productCode":"998314","quantity":"1","rateId":"gst_18","rateSnapshot":{"category":"standard","label":"GST 18%","percent":"18"},"taxMinor":803182,"taxableMinor":4462121,"totalMinor":5265303,"unit":"JOB","unitPriceMinor":5000000},{"amountMinor":1440000,"description":"Hosting","id":"da000000-0000-4000-8000-000000000002","position":1,"productCode":"998315","quantity":"12","rateId":"gst_18","rateSnapshot":{"category":"standard","label":"GST 18%","percent":"18"},"taxMinor":257018,"taxableMinor":1427879,"totalMinor":1684897,"unit":"MON","unitPriceMinor":120000}],"notes":"Thank you for your business","number":"INV/26-27/0001","periodKey":"FY2026","pricesIncludeTax":false,"reverseCharge":false,"revision":1,"sellerSnapshot":{"address":"12 MG Road, Bengaluru 560001","bank":{"accountName":"Bharat Web Studio LLP","accountNumber":"000123456789","ifsc":"EXMP0001234"},"country":"IN","customRates":[{"category":"zero","components":[{"code":"TAX","label":"Tax","percent":"0"}],"effectiveFrom":"2000-01-01","id":"none","label":"No tax"}],"email":"hello@example.in","extraIds":{"lutReference":"AD2903260123456","lutValidUntil":"2027-03-31","pan":"AAGCB7383J"},"homeCurrency":"INR","legalName":"Bharat Web Studio LLP","logoAssetId":"00000000-0000-4000-8000-000000000004","lutReference":"AD2903260123456","name":"Bharat Web Studio","phone":"+91 80 5555 0100","postalAddress":{"city":"Bengaluru","countryCode":"IN","line1":"12 MG Road","postalCode":"560001","regionCode":"29"},"region":"29","registration":"regular","signatureAssetId":"00000000-0000-4000-8000-000000000005","taxId":"29AAGCB7383J1Z4","turnoverMinor":5000000001,"upiVpa":"bharatweb@examplebank","website":"https://example.in"},"sequence":1,"seriesId":"00000000-0000-4000-8000-000000000002","shippingMinor":0,"supplyType":"domestic","taxConfigRef":"IN@2025-09-22","templateId":"classic","terms":"Payment within 30 days","totals":{"discountMinor":50000,"roundOffMinor":0,"shippingMinor":0,"subtotalMinor":5940000,"taxMinor":1060200,"taxNotChargedMinor":0,"taxableMinor":5890000,"totalMinor":6950200},"updatedAt":1011},{"businessId":"b0000000-0000-4000-8000-000000000001","buyerSnapshot":{"address":"21 Nariman Point, Mumbai 400021","billingAddress":{"city":"Mumbai","countryCode":"IN","line1":"21 Nariman Point","postalCode":"400021","regionCode":"27"},"country":"IN","isBusiness":true,"name":"Mehta Exports","region":"27","taxId":"27AAECM5678F1Z6"},"clientId":"c0000000-0000-4000-8000-000000000002","computed":{"chargesTax":true,"inclusive":false,"issues":[],"lines":[{"amount":1500000,"category":"standard","discount":0,"rate":"18","rateId":"gst_18","taxable":1500000,"taxes":[{"amount":270000,"component":"IGST","rate":"18"}]}],"notes":[],"placeOfSupply":"27","reverseCharge":false,"sameRegion":false,"shipping":{"amount":25000,"parts":[{"amount":25000,"rateId":"gst_18","taxable":25000}],"taxable":25000},"taxLines":[{"category":"standard","charged":true,"component":"IGST","rate":"18","tax":274500,"taxable":1525000}],"title":"Tax Invoice","totals":{"discount":0,"roundOff":0,"shipping":25000,"subtotal":1500000,"tax":274500,"taxNotCharged":0,"taxable":1525000,"total":1799500}},"createdAt":1015,"currency":"INR","docType":"invoice","dueDate":"2026-10-19","id":"d0000000-0000-4000-8000-000000000002","issueDate":"2026-09-19","lifecycle":"issued","lines":[{"amountMinor":1500000,"description":"Logo pack","id":"da000000-0000-4000-8000-000000000003","position":0,"productCode":"998391","quantity":"1","rateId":"gst_18","rateSnapshot":{"category":"standard","label":"GST 18%","percent":"18"},"taxMinor":270000,"taxableMinor":1500000,"totalMinor":1770000,"unit":"JOB","unitPriceMinor":1500000}],"notes":"Thank you","number":"INV/26-27/0002","periodKey":"FY2026","pricesIncludeTax":false,"reverseCharge":false,"revision":1,"sellerSnapshot":{"address":"12 MG Road, Bengaluru 560001","bank":{"accoun